{
  "$schema": "https://json-schema.org/draft/2020-12/schema",
  "$id": "https://github.com/albertc9/RAVEL/schemas/ravel_manifest.schema.json",
  "title": "RAVEL Aria generation manifest schema v5",
  "type": "object",
  "additionalProperties": false,
  "required": [
    "schema_version",
    "ravel",
    "source_model",
    "dependencies",
    "normalized_configuration",
    "generation_configuration",
    "configuration_sha256",
    "profile",
    "implementation_plan",
    "implementation_sha256",
    "pipeline",
    "interfaces",
    "verification",
    "status",
    "source_closure",
    "source_closure_sha256",
    "generation_fingerprint",
    "resolved_design",
    "architecture_contract_sha256",
    "architecture_envelope",
    "architecture_envelope_sha256",
    "coefficient_realization",
    "coefficient_realization_sha256"
  ],
  "properties": {
    "schema_version": {"const": 5},
    "ravel": {
      "type": "object",
      "required": ["product", "generation", "release", "package_version"],
      "properties": {
        "product": {"const": "RAVEL"},
        "generation": {"const": "Aria"},
        "release": {"const": "1.5.1"},
        "package_version": {"type": "string"}
      }
    },
    "source_model": {
      "type": "object",
      "required": ["source_artifact_sha256", "semantic_model_sha256"],
      "properties": {
        "source_artifact_sha256": {
          "type": ["string", "null"],
          "pattern": "^[0-9a-f]{64}$"
        },
        "semantic_model_sha256": {
          "type": "string",
          "pattern": "^[0-9a-f]{64}$"
        }
      }
    },
    "dependencies": {"type": "object"},
    "normalized_configuration": {"type": "object"},
    "generation_configuration": {"type": "object"},
    "configuration_sha256": {"$ref": "#/$defs/sha256"},
    "profile": {"type": "object"},
    "implementation_plan": {"type": "object"},
    "implementation_sha256": {"$ref": "#/$defs/sha256"},
    "pipeline": {"type": "object"},
    "interfaces": {"type": "object"},
    "verification": {"type": "object"},
    "status": {"type": "object"},
    "source_closure": {
      "type": "array",
      "minItems": 1,
      "items": {
        "type": "object",
        "additionalProperties": false,
        "required": ["role", "path", "size", "sha256"],
        "properties": {
          "role": {
            "enum": [
              "model",
              "configuration",
              "vendor_script",
              "parameter",
              "firmware",
              "simulation",
              "project"
            ]
          },
          "path": {"type": "string", "minLength": 1},
          "size": {"type": "integer", "minimum": 0},
          "sha256": {"$ref": "#/$defs/sha256"}
        }
      }
    },
    "source_closure_sha256": {"$ref": "#/$defs/sha256"},
    "generation_fingerprint": {"$ref": "#/$defs/sha256"},
    "resolved_design": {
      "type": "object",
      "required": [
        "generation",
        "model_family",
        "strategy",
        "resolver",
        "implementation_plan",
        "interfaces",
        "parameter_bindings",
        "executed_passes",
        "resolved_design_sha256"
      ]
    },
    "architecture_contract_sha256": {"$ref": "#/$defs/sha256"},
    "architecture_envelope": {
      "type": "object",
      "required": [
        "schema_version",
        "generation",
        "model_family",
        "model_structure_sha256",
        "strategy",
        "resolver",
        "specialization",
        "implementation_plan",
        "interfaces",
        "streaming",
        "rendering",
        "parameter_bindings",
        "passes"
      ],
      "properties": {
        "schema_version": {"const": 1},
        "model_structure_sha256": {"$ref": "#/$defs/sha256"}
      }
    },
    "architecture_envelope_sha256": {"$ref": "#/$defs/sha256"},
    "coefficient_realization": {"type": ["object", "null"]},
    "coefficient_realization_sha256": {
      "anyOf": [
        {"$ref": "#/$defs/sha256"},
        {"type": "null"}
      ]
    }
  },
  "$defs": {
    "sha256": {"type": "string", "pattern": "^[0-9a-f]{64}$"}
  }
}
