{
  "architecture_contract_sha256": "96cc3d2127c5e4f351886ad0c4ada9eae66cf84d28266c48afdf49b5a716e855",
  "architecture_envelope": {
    "generation": {
      "id": "aria",
      "version": "1.5.1"
    },
    "implementation_plan": {
      "channels_per_row": 4,
      "dataflow_start_propagation": false,
      "dense_inputs": 4960,
      "dense_parallelism": 2,
      "dense_steps": 124,
      "filter_lanes": 20,
      "first_convolution": {
        "id": "full-width-latency",
        "multiplier_limit": 560,
        "parallel_windows": 4,
        "products_per_window": 140,
        "schedule": {
          "first_window_end": 6,
          "id": "next-window-end",
          "input_words": 128,
          "last_window_end": 254,
          "maximum_outputs_per_input_word": 1,
          "output_rows": 125,
          "status": "proven",
          "version": 1
        },
        "target_loop_ii": 1,
        "version": 1
      },
      "input_words_per_inference": 128,
      "internal_fifo_depth": 4,
      "template_profile": "aria-p2-d2-v4",
      "temporal_pack": 2,
      "values_per_input_word": 8,
      "values_per_internal_word": 80,
      "weight_delivery": {
        "accumulation": {
          "policy": "ordered"
        },
        "applicability": {
          "reasons": [],
          "status": "applicable"
        },
        "depth": 124,
        "id": "wide-sequential",
        "mac_lanes": 40,
        "multipliers": {
          "implementation": "dsp",
          "instances": 40
        },
        "storage": {
          "implementation": "bram",
          "type": "rom_1p"
        },
        "tail_elements": 0,
        "tail_mask": 1099511627775,
        "version": 1,
        "word_bits": 240
      },
      "width_lanes": 4
    },
    "interfaces": {
      "hls_stream": {
        "input_rows_per_word": 2,
        "input_words_per_inference": 128,
        "values_per_input_word": 8
      },
      "logical": {
        "input_shape": [
          256,
          4
        ],
        "output_shape": [
          1
        ]
      },
      "rtl": {
        "input_tdata_bits": 128,
        "output_tdata_bits": 32
      }
    },
    "model_family": {
      "id": "hgq-conv-pool-dense",
      "version": 1
    },
    "model_structure_sha256": "6c8d9d282085ddce0f59480cf92a195b27da1f0aca11e957c4c1b61880aa597e",
    "parameter_bindings": [
      {
        "descriptor": {
          "numeric_type": {
            "integer": 0,
            "kind": "fixed",
            "rounding": "TRN",
            "saturation": "WRAP",
            "saturation_bits": 0,
            "signed": true,
            "width": 4
          },
          "role": "bias",
          "shape": [
            20
          ]
        },
        "id": "conv2d_0:bias"
      },
      {
        "descriptor": {
          "numeric_type": {
            "integer": 1,
            "kind": "fixed",
            "rounding": "TRN",
            "saturation": "WRAP",
            "saturation_bits": 0,
            "signed": true,
            "width": 6
          },
          "role": "weight",
          "shape": [
            7,
            1,
            1,
            20
          ]
        },
        "id": "conv2d_0:weight"
      },
      {
        "descriptor": {
          "numeric_type": {
            "integer": -1,
            "kind": "fixed",
            "rounding": "TRN",
            "saturation": "WRAP",
            "saturation_bits": 0,
            "signed": true,
            "width": 3
          },
          "role": "bias",
          "shape": [
            1
          ]
        },
        "id": "dense_0:bias"
      },
      {
        "descriptor": {
          "numeric_type": {
            "integer": 1,
            "kind": "fixed",
            "rounding": "TRN",
            "saturation": "WRAP",
            "saturation_bits": 0,
            "signed": true,
            "width": 6
          },
          "role": "weight",
          "shape": [
            4960,
            1
          ]
        },
        "id": "dense_0:weight"
      }
    ],
    "passes": [
      {
        "id": "pack-temporal-input",
        "order": 1,
        "result": "applied",
        "version": 1
      },
      {
        "id": "fuse-repack-into-first-conv",
        "order": 2,
        "result": "applied",
        "version": 2
      },
      {
        "id": "propagate-wide-relu-stream",
        "order": 3,
        "result": "applied",
        "version": 1
      },
      {
        "id": "specialize-nonoverlapping-maxpool",
        "order": 4,
        "result": "applied",
        "version": 1
      },
      {
        "id": "stream-flatten-into-dense",
        "order": 5,
        "result": "applied",
        "version": 1
      },
      {
        "id": "bind-shallow-internal-fifos",
        "order": 6,
        "result": "applied",
        "version": 1
      },
      {
        "id": "elide-dataflow-start-propagation",
        "order": 7,
        "result": "applied",
        "version": 1
      }
    ],
    "rendering": {
      "first_convolution_function": "first_conv_2row_4lane_temporal_wide_cl",
      "operations": {
        "conv2d_0": {
          "config_symbol": "config4",
          "output_precision_cpp": "ap_fixed<16,6>",
          "output_symbol": "layer4_out",
          "output_type": "q_conv2d_t"
        },
        "dense_0": {
          "config_symbol": "config9",
          "output_precision_cpp": "ap_fixed<24,14>",
          "output_symbol": "layer9_out",
          "output_type": "result_t"
        },
        "input_0": {
          "output_precision_cpp": "ap_fixed<10,5,AP_RND,AP_SAT_SYM,0>",
          "output_symbol": "waveform",
          "output_type": "waveform_t"
        },
        "max_pool2d_0": {
          "config_symbol": "config6",
          "output_precision_cpp": "ap_fixed<10,5,AP_RND,AP_SAT_SYM,0>",
          "output_symbol": "layer6_out",
          "output_type": "max_pooling2d_t"
        },
        "relu_0": {
          "config_symbol": "relu_config5",
          "output_precision_cpp": "ap_ufixed<15,5>",
          "output_symbol": "layer5_out",
          "output_type": "q_conv2d_relu_t"
        },
        "repack_0": {
          "output_precision_cpp": "ap_fixed<10,5>",
          "output_symbol": "layer10_out",
          "output_type": "ravel_repack_t"
        },
        "reshape_0": {
          "output_precision_cpp": "ap_fixed<10,5,AP_RND,AP_SAT_SYM,0>",
          "output_symbol": "layer7_out",
          "output_type": "max_pooling2d_t"
        }
      },
      "streams": {
        "activation": "layer5_out_x4",
        "convolution": "layer4_out_x4",
        "pooling": "layer6_out_x4"
      },
      "types": {
        "activation_wide": "q_conv2d_relu_x4_t",
        "convolution_wide": "q_conv2d_x4_t",
        "input_wide": "waveform_x2_t",
        "pooling_wide": "max_pooling2d_x4_t"
      }
    },
    "resolver": {
      "id": "aria-explicit-pd",
      "version": 2
    },
    "schema_version": 1,
    "specialization": {
      "dense_parallelism": 2,
      "temporal_packing": 2
    },
    "strategy": {
      "id": "aria-wide-stream",
      "version": 2
    },
    "streaming": {
      "activation": {
        "operation_id": "relu_0",
        "values_per_word": 80
      },
      "buffers": {
        "depth": 4,
        "storage": "srl"
      },
      "dataflow_control": {
        "block_control": "ap_ctrl_hs",
        "start_propagation": false
      },
      "dense": {
        "inputs": 4960,
        "operation_id": "dense_0",
        "parallelism": 2,
        "steps": 124,
        "weight_delivery": {
          "accumulation": {
            "policy": "ordered"
          },
          "applicability": {
            "reasons": [],
            "status": "applicable"
          },
          "depth": 124,
          "id": "wide-sequential",
          "mac_lanes": 40,
          "multipliers": {
            "implementation": "dsp",
            "instances": 40
          },
          "storage": {
            "implementation": "bram",
            "type": "rom_1p"
          },
          "tail_elements": 0,
          "tail_mask": 1099511627775,
          "version": 1,
          "word_bits": 240
        }
      },
      "first_convolution": {
        "filter_lanes": 20,
        "kernel": [
          7,
          1
        ],
        "operation_id": "conv2d_0",
        "stride": [
          2,
          1
        ],
        "width_lanes": 4
      },
      "input": {
        "rows_per_word": 2,
        "values_per_word": 8,
        "words_per_inference": 128
      },
      "pooling": {
        "operation_id": "max_pool2d_0",
        "stride": [
          2,
          1
        ],
        "window": [
          2,
          1
        ]
      }
    }
  },
  "architecture_envelope_sha256": "96cc3d2127c5e4f351886ad0c4ada9eae66cf84d28266c48afdf49b5a716e855",
  "coefficient_realization": null,
  "coefficient_realization_sha256": null,
  "configuration_sha256": "fcb34e01094249035ad6ac0be5eac78451614bd5e09e0c6154f9ae3933e9a7bd",
  "dependencies": {
    "Jinja2": {
      "installed": "3.1.6",
      "required": "==3.1.6",
      "status": "qualified"
    },
    "PyYAML": {
      "installed": "6.0.3",
      "required": "==6.0.3",
      "status": "qualified"
    },
    "hgq2": {
      "installed": "0.1.7",
      "required": "==0.1.7",
      "status": "qualified"
    },
    "hls4ml": {
      "installed": "1.2.0",
      "required": "==1.2.0",
      "status": "qualified"
    },
    "keras": {
      "installed": "3.12.1",
      "required": "==3.12.1",
      "status": "qualified"
    },
    "numpy": {
      "installed": "1.26.4",
      "required": "==1.26.4",
      "status": "qualified"
    },
    "quantizers": {
      "installed": "1.2.2",
      "required": "==1.2.2",
      "status": "qualified"
    }
  },
  "generation_configuration": {
    "hls4ml": {
      "Backend": "Vitis",
      "ClockPeriod": 5,
      "IOType": "io_stream",
      "Part": "xcku5p-ffvb676-2-e",
      "ProjectName": "legacy_p2d2",